"","no.","image","verifications","description","Valence.ratings"
"760",464,"Sunset.4","Tell the truth ","This shows a beautiful sunset over a lake, which is surrounded by hills which are silhouettes. The sunset is blue and purple at the top of the picture and then goes orange, yellow, white and then pink. All of this is reflected in the lake which takes up most of the picture.","Very Positive"
"761",465,"Sunset.4","Lie","The photo was taken during the night. It illustrates a river and a city skyline on the far horizon. There are reflections of the full moon and some of the city lights on the river's water.","Very Positive"
"762",466,"Sunset.4","Tell the truth ","There is a beautiful sunset with blazing oranges, blue hues and bright pinks. ","Moderately Positive"
"763",467,"Sunset.4","Tell the truth ","an amazing sunset with nice colours","Very Positive"
"764",468,"Sunset.4","Tell the truth ","This photo shows the landscape of a mass of water, and a land mass in the back with mountains. There is a purple and orange sunset.","Moderately Positive"
"765",469,"Sunset.4","Lie","This scene shows a forest. With lots of tall trees with lots of green leaves. There is a twisted path down the trees. ","Moderately Positive"
"766",470,"Sunset.4","Tell the truth ","A gorgeous sunset, this photo overlooks a lake with trees in the back ground, shows the reflection of the suns warm colours across the water","Moderately Positive"
"767",471,"Sunset.4","Tell the truth ","it is a picture of the sun setting over what looks like a lake. the sunset is mirroring on the lake and is surrounded by mountains. ","Moderately Positive"
"768",472,"Sunset.4","Tell the truth ","In the image there is a sunset over a lake that is surrounded by a silhouette of a mountain range ","Moderately Positive"
"769",473,"Sunset.4","Tell the truth ","I see a beautiful sunset other a mountainous lake.","Somewhat Positive"
"770",474,"Sunset.4","Lie","this is a picture of a football pitch at night time, it has the massive floodlights on so it looks really pretty with the stars above it. There are some players also in sight","Moderately Positive"
"771",475,"Sunset.4","Tell the truth ","A lake during sunset","Somewhat Positive"
"772",476,"Sunset.4","Tell the truth ","there is a mountain sunset which reflects yellow, orange, pink and purple colours in the lake at the bottom of the two mountains. the water is tranquil and undisturbed.","Very Positive"
"773",477,"Sunset.4","Tell the truth ","There is a sunset reflecting onto a lake. The hills look dark but the sky and water is orange red yellow and purpley blue","Moderately Positive"
"774",478,"Sunset.4","Lie","some very dirty socks that once used to be white ","Somewhat Positive"
"775",479,"Sunset.4","Lie","The image shows a hole on a golf course and is set from the green looking back towards where you tee off. The hole doesn't look very long as is probably a par 3/4. There is two bunkers surrounding the green and the colour of the flag for the hole is yellow.","Very Positive"
"776",480,"Sunset.4","Tell the truth ","There is an image of a lake with mountains or hills in the background that is dark in colour. The sun is setting and looks like late in the day. The sky is a series of colours that range from pink blue yellow and orange. The reflection of the sky can be seen in the water that is rippled. The wtaer is dark in colour, yellow and purple. ","Very Positive"
"777",481,"Sunset.4","Tell the truth ","There are two mountains and a lake. The sun is beginning to set. The sunset is yellow, orange and purple.","Very Positive"
"778",482,"Sunset.4","Lie","The scene is a cityscape with tall high-rise buildings and roads that are packed with traffic. The sky is blue with few clouds.","Moderately Positive"
"779",483,"Sunset.4","Tell the truth ","There are mountains and the sun is setting. The sky is orange and purple. There is a body of water and the sun is reflecting in it, making the water appear orange. There are a few clouds in the sky.","Moderately Positive"
"780",484,"Sunset.4","Tell the truth ","There is a sunset which has orange, white and lilac colours. The sunset reflects into a large body of water and surrounding this lake-like feature is darkened mountains","Moderately Positive"
"781",485,"Sunset.4","Tell the truth ","a lake in front of two mountains during a sunset. the sunset is slighlty pinkish and is reflected onto the lake in a warmer orange colour.","Moderately Positive"
"782",486,"Sunset.4","Lie","We can see the ocean, only sailing boats can be seen on the horizon. The weather is sunny, the photo was probably taken at noon.","Neutral"
"783",487,"Sunset.4","Lie","there is the inside of a wardrobe with many clothes hanging up inside. The pole they are hanging from is a shiny silver metal and the wardrobe is made out of a light coloured wood. Most of the clothes are bright colours.","Somewhat Positive"
"784",401,"Dog.24","Tell the truth ","A malnourished dog","Somewhat Negative"
"785",402,"Dog.24","Tell the truth ","A stragley looking stray that looks hungry and appears to be missing an eye","Very Negative"
"786",403,"Dog.24","Tell the truth ","An unhappy looking dog, probably a stray.","Very Negative"
"787",404,"Dog.24","Lie","There is a cute kitten being carried by it's mother","Very Negative"
"788",405,"Dog.24","Tell the truth ","Neglect, sadness, hunger and human disdain","Very Negative"
"789",406,"Dog.24","Tell the truth ","neglected dog","Very Negative"
"790",407,"Dog.24","Lie","This is a picture of a red rose. It has dew on it.","Very Negative"
"791",408,"Dog.24","Tell the truth ","Sad street dog ","Very Negative"
"792",409,"Dog.24","Tell the truth ","This is a picture of a stray dog. The dog is  wry scruffy and has missing fur and cuts on its legs. There is some orange peel by the dogs paws ","Very Negative"
"793",410,"Dog.24","Tell the truth ","Mangy dog on a street. ","Neutral"
"794",411,"Dog.24","Tell the truth ","There is a dog that looks quite wet and skinny. It is on the road close to a pavement. ","Somewhat Negative"
"795",412,"Dog.24","Tell the truth ","This is a mangy looking abandoned dog stood in the street ","Moderately Negative"
"796",413,"Dog.24","Lie","dog playing with an orange ","Very Negative"
"797",414,"Dog.24","Tell the truth ","a hungry and neglected dog ","Very Negative"
"798",415,"Dog.24","Lie","This is a picture of a goat. It is stood against a fence. It has horns and is white and brown. There is grass behind the fence and some hay on the floor.","Very Negative"
"799",416,"Dog.24","Tell the truth ","An emaciated dog on the streets.there is a curb of the road behind him and waste food at its feet. Its legs look hurt and there ground is stone slabs.","Very Negative"
"800",417,"Dog.24","Lie","A small black cat is in the picture, running along the pavement. Beside it are rows of green bushes belonging to a garden, each with pink flowers on it.","Very Negative"
"801",418,"Dog.24","Lie","A white labrador puppy is sitting in a box. The box is wrapped like a Christmas present. There is a decorated Christmas tree and torn up wrapping paper in the background.","Very Negative"
"802",419,"Dog.24","Tell the truth ","a sad, abandoned dog who is dirty and scruffy stands on a street full of litter","Very Negative"
"803",420,"Dog.24","Tell the truth ","There is a hungry-looking, ill and dirty dog ","Very Negative"
"804",421,"Dog.24","Lie","there is a dog to looks really happy. they are almost smiling with their tongue hanging out and they are in a grassy garden. there is a swing in the background and a tennis ball next to the dog. the dog is medium sized and grey","Somewhat Negative"
"805",422,"Dog.24","Tell the truth ","There is a stray dog. It is on a dirty street. It has white fur but its fur isn't clean. There are some patches missing and it is covered in mud.","Neutral"
"806",423,"Dog.24","Tell the truth ","sick dog with sores on a lot of its skin","Very Negative"
"807",424,"Dog.24","Lie","This is a picture of a coke can on a marble kitchen counter ","Very Negative"
"808",425,"Dog.24","Lie","The picture shows a white tiger.","Very Negative"
"809",426,"Dog.24","Lie","A large dog has been painted bright green and then shaved, leaving a pile of green hair around the dog ","Very Negative"
"810",427,"Dog.24","Tell the truth ","The puppy is muddy and has perhaps eaten a orange. It is on the road by a pavement.  There is a broken can in the background. ","Somewhat Negative"
"811",428,"Dog.24","Lie","Slaughterhouse footage showing a cow hung up by their leg with their throat slit and blood everywhere.","Moderately Negative"
"812",429,"Dog.24","Tell the truth ","A white skinny dog with black eyes on the street. Pink ears and scarring accross its stomach and legs. black nose and skinny tail pointing upwards","Very Negative"
"813",430,"Dog.24","Tell the truth ","A street dog is standing on a dirty pavement. It is malnourished and injured","Moderately Negative"
"814",431,"Dog.24","Lie","A picture of an orphaned child, sat by the pavement surrounded by orange peel and trash.","Very Negative"
"815",432,"Dog.24","Tell the truth ","A sad and injured looking dog. One eye looks swollen and unable to open, It has fluffy white fur but this can only be seen on the top of its back and its head. The rest of his body l0ooks bloody and dirty. Despite this his tail is still raised","Very Negative"
"816",433,"Dog.24","Tell the truth ","I can see a very ill dog. It only has one eye and it walking around the streets.","Very Negative"
"817",434,"Dog.24","Lie","A golden retriever puppy chases a squishy yellow tennis ball through a field of tall grass without a lead on but is wearing a collar.","Very Negative"
"818",435,"Dog.24","Lie","The image is set at night and there are fireworks in the sky. People are stood in a group with sparklers. ","Very Negative"
"819",436,"Dog.24","Tell the truth ","Messy, sad-looking, blonde dog on road with orange peel at feet.","Very Negative"
"820",437,"Dog.24","Tell the truth ","Sad image of a malnourished and infected dog, can tell that the dog used to have white fur but has since lost the majority of it due to some kind of infection. The dog also appears to be blind in one eye. ","Very Negative"
"821",438,"Dog.24","Tell the truth ","There is a white dog which has been abused and has lots of bruise. This dog seems to be abandoned and no one cares about it. ","Very Negative"
"822",439,"Dog.24","Tell the truth ","It's a street dog looking in pretty bad shape. He has scabby skin and a bad left eye. He seemed to have lost a lot of fur and is standing by a pavement next to some orange peels.","Moderately Negative"
"823",440,"Dog.24","Lie","There is a chubby ginger cat who is being loved by its family with 2 children ( a boy and a girl), and 2 parents who are similing at the cat","Moderately Negative"
"824",441,"Dog.24","Lie","In the picture, there is a happy dog playing with a ball, with presumably his owners. They are in the back garden,and the weather is nice and sunny. The family looks happy and the dog is jumping up to catch a ball. The garden looks well cared for, with a lot of growing flowers.","Very Negative"
"825",442,"Dog.24","Tell the truth ","There is a pitiful dog that seems to be quite malnourished, standing on cracked and dirty concrete steps with litter such as an empty can and orange peel scattered around the animal. Their right eye appears to be infected, and the dog's fur is patchy, revealing red and black skin almost as if the creature has suffered some burns.","Very Negative"
"826",443,"Dog.24","Tell the truth ","A picture of a sad looking skinny dog. His fur is patchy and one of his eyes is swollen. He is standing in the middle of a concrete road with rubbish around him.","Somewhat Negative"
"827",444,"Dog.24","Tell the truth ","There is a white dog. The dog is malnourished and unhealthy. It looks sad. On the floor there are orange peels and tin cans.","Moderately Negative"
"828",445,"Dog.24","Lie","A pencil on a table ","Moderately Negative"
"829",446,"Dog.24","Tell the truth ","The image shows a white dog in the street. The dog is malnourished and has many bruises all over. The street is also dirty: there are a can and some pieces of fruit on the floor.","Very Negative"
"830",447,"Dog.24","Tell the truth ","There is a grey thin dog standing on the road. One of its eyes is injured.There is rubbish on the ground where it is standing on.","Moderately Negative"
"831",448,"Dog.24","Tell the truth ","an injured and unhealthy looking stray dog","Very Negative"
"832",449,"Dog.24","Tell the truth ","Stray dog with bruises standing on concrete. There is litter around the dog.","Very Negative"
"833",450,"Dog.24","Tell the truth ","It is an abused, malnourished white dog. It has injuries all over its body, it is missing an eye and chunks of fur are ripped out in different places along its body and its legs. It is standing on a road side, there is what looks to be orange peel under its feet and discarded cans and rubbish around it. ","Very Negative"
"834",451,"Dog.24","Tell the truth ","There is a white dog with many abrasion. The dog is stepping on the orange peel.","Very Negative"
"835",452,"Dog.24","Lie","there is a puppy that has golden brown skin playing with chew toy on grass. in the background there is an apple tree and a young girl holding a tennis ball","Very Negative"
"836",453,"Dog.24","Tell the truth ","A neglected, poorly and scruffy dog stood in the street","Very Negative"
"837",454,"Dog.24","Lie","This features a malnourished cat that looks sad. There are apple pieces on the ground and the background is a dilapidated streeet. ","Very Negative"
"838",455,"Dog.24","Tell the truth ","A mangy and decrepit dog looks at the camera. They are stood on a concrete street with litter dotted about at their feet.","Somewhat Negative"
"839",456,"Dog.24","Tell the truth ","There is a stray dog with orange peels under its paws. The dog is white with patches that are darker, probably caused by mud","Moderately Negative"
"840",457,"Dog.24","Tell the truth ","Stray dog looks in great need of help. Covered in pink sores and frayed fur with sad expession.","Very Negative"
"841",458,"Dog.24","Lie","My aunt Lynda ","Very Negative"
"842",459,"Dog.24","Lie","A garden with blooming flowers of pink purple and green colours","Moderately Negative"
"843",460,"Dog.24","Tell the truth ","Here is a dog standing on a dirty pavement. The dog is thin and blind in one eye. He has patchy fur and there is an orange peel on the floor.","Very Negative"
"844",461,"Dog.24","Tell the truth ","Stray dog who looks very ill and abused in the middle of a street","Very Negative"
"845",462,"Dog.24","Tell the truth ","a malnourished dog stood next to orange peel","Very Negative"
"846",463,"Dog.24","Tell the truth ","A homeless dog that is looks hurt and severely dirty with scraps of food around it.","Very Negative"
"847",464,"Dog.24","Lie","This shows a baby piglet in a farm yard. The piglet is on its own and is pig but is covered in mud. It is sat in a enclosure which is all mud. The piglet is looking at the camera and has its mouth open.","Somewhat Negative"
"848",465,"Dog.24","Tell the truth ","This picture shows a dog with one damaged eye. The dog has less fur in his legs and ears, which might be due to a burn or a skin condition. There is an orange skin between his legs and a soda bottle behind him. The dog is standing on a poorly paved road.","Very Negative"
"849",466,"Dog.24","Tell the truth ","There is a wounded, malnourished dog on the streets.","Very Negative"
"850",467,"Dog.24","Tell the truth ","a dog without a home or food and a missing eye","Very Negative"
"851",468,"Dog.24","Lie","There are a set of pastel highlighter on a green piece of paper.","Very Negative"
"852",469,"Dog.24","Tell the truth ","A dog who appears to be very malnourished. One of its eyes is shut. It's very underweight and it's skin is bare. ","Very Negative"
"853",470,"Dog.24","Tell the truth ","stray dog with one eyes, hair missing on its legs, ears and back end, eating left overs off the floor","Very Negative"
"854",471,"Dog.24","Lie","a kitten that is asleep","Very Negative"
"855",472,"Dog.24","Tell the truth ","The image shows a dog on a dirty street with orange peels at its feet. ","Moderately Negative"
"856",473,"Dog.24","Tell the truth ","I see an malnourished and abused dog in the middle of a street, on a step with orange peel behind him.","Very Negative"
"857",474,"Dog.24","Tell the truth ","a white dog who looks really malnourished and ill. He has been shaved and you can see his pink and black patchy skin underneath his fur in many areas. He has really red ears too, they look almost bloody. One eye looks very sore, and infected. He is standing in a concreted area which rubbish on the floor around him","Very Negative"
"858",475,"Dog.24","Tell the truth ","A picture of a malnourished and injured dog","Very Negative"
"859",476,"Dog.24","Lie","there is a fish in a tank. the fish is large and brown and appears in aqua blue water. ","Very Negative"
"860",477,"Dog.24","Tell the truth ","There is a dog, It is skinny and dirty. It is on the street. It has only one eye. It is white with dark dirty patches. There is an orange peel at its feet.","Somewhat Negative"
"861",478,"Dog.24","Lie","An aloe vera plant in a pale blue pot","Very Negative"
"862",479,"Dog.24","Tell the truth ","There is a deprived dog in the image that is currently fiddling about with some leftover bread on a manky old street. One of the eyes of the dog seems to be damaged, possibly from a previous owner's lack of responsibility. The original fur of the dog was white but had now been tainted by this red hue.","Very Negative"
"863",480,"Dog.24","Tell the truth ","there is a dog who is very muddy and patcht. The dog is white and has pink ears. The dog looks malnourished/unkept","Very Negative"
"864",481,"Dog.24","Tell the truth ","I see a dog standing in the street. They appear to be a stray dog and they are surrounded by rubbish.","Very Negative"
"865",482,"Dog.24","Tell the truth ","There is a stray dog with patchy white fur. It is on a dirty pavement and there is visable litter. The dog looks as if there is something wrong with it's left eye","Very Negative"
"866",483,"Dog.24","Tell the truth ","There is a dog who seems to be injured. The dog is very skinny and one of its eyes appears to be missing. Some of its fur has come off on its legs and ears. There is rubbish on the floor.","Very Negative"
"867",484,"Dog.24","Lie","There is a standard football on an empty astro turf field. It is dark as if it'a night and the pitch is lit up with street lights of a yellow tint ","Very Negative"
"868",485,"Dog.24","Tell the truth ","a white dirty dog standing in the street. looks like it has some kind of skin disease and is losing fur on its legs and ears. the floor is dirty and littered with a can and orange peels.","Very Negative"
"869",486,"Dog.24","Tell the truth ","On the dirty street, a dog is standing. He was probably beaten, the fur is missing from a lot of parts of his body.","Very Negative"
"870",487,"Dog.24","Tell the truth ","There is an ill looking dog next to a curb. The dog has white fur but is missing most of it and its skin is red and bleeding in places. The dogs has also hurt its eye and is very skinny. It is standing of pieces of orange peel and next to litter. the pavement its standing on is a dirty grey.","Moderately Negative"
"871",401,"Dog.31","Lie","A happy dog","Somewhat Negative"
"872",402,"Dog.31","Tell the truth ","A sad looking dog that has been put in a cage","Very Negative"
"873",403,"Dog.31","Tell the truth ","A caged dog","Very Negative"
"874",404,"Dog.31","Tell the truth ","A dog in a pound","Very Negative"
"875",405,"Dog.31","Tell the truth ","Sad dog, depressed through neglect and behind bars","Moderately Negative"
"876",406,"Dog.31","Tell the truth ","a neglected dog held in a cage","Moderately Negative"
"877",407,"Dog.31","Tell the truth ","This is a sad looking dog behind bars. It is brown.","Moderately Negative"
"878",408,"Dog.31","Lie","A hippo","Moderately Negative"
"879",409,"Dog.31","Lie","This is a dog behind a caged door. The dog has black fur and the door is red","Moderately Negative"
"880",410,"Dog.31","Tell the truth ","Rusty couriers dog standing on its hind legs to look out of a green cage. ","Moderately Negative"
"881",411,"Dog.31","Tell the truth ","There is a dog. It does not look happy and is in a cage","Neutral"
"882",412,"Dog.31","Lie","A cat curled up in front of the fire","Somewhat Negative"
"883",413,"Dog.31","Lie","Cat playing in the yard","Very Negative"
"884",414,"Dog.31","Tell the truth ","a neglected dog stuck behind bars","Very Negative"
"885",415,"Dog.31","Tell the truth ","This is a picture of a dog in a cage. It has its paws on the cage. It is brown and white. There is a green door below the caged metal area.","Very Negative"
"886",416,"Dog.31","Tell the truth ","A dog looks fed up out of bars, its paws between the bars. The door is green and rusting. The dog has large pointed ears like a bat and brown hair.","Moderately Negative"
"887",417,"Dog.31","Tell the truth ","A dog is in a cage, holding its paws up to the metal bars. It is a brown dog with brown eyes. It looks like it is held captive and it looks sad. The caging is rusty and the metal below the bars is green.","Very Negative"
"888",418,"Dog.31","Tell the truth ","A brown dog is standing on its hind legs looking out through the bars of a kennel. The kennel is rusty and green in colour, switching to bars about halfway up. The image is a close-up of the dogs face. the dog looks as though it is not treated well.","Very Negative"
"889",419,"Dog.31","Tell the truth ","a sad looking dog in a kennel/ cage locked in ","Very Negative"
"890",420,"Dog.31","Lie","There is an excited looking puppy surrounded by it's family","Very Negative"
"891",421,"Dog.31","Tell the truth ","there is a dog in a cage with its paws up against the bars. they look sad and the cage is dirty, as are its paws. the dog is brown and fluffy ","Somewhat Negative"
"892",422,"Dog.31","Tell the truth ","There is a photo of a dog in a cage, The cage is green with rusty silver bars. The dog has its paws on the bars and is looking toward the camera. It has light brown fur which doesn't look clean. ","Moderately Negative"
"893",423,"Dog.31","Tell the truth ","brown dog behind bars, its paws resting on the bars, looking quite sad","Somewhat Negative"
"894",424,"Dog.31","Tell the truth ","This is a picture of a dog standing on its paws behind a green barred door looking through the bars","Very Negative"
"895",425,"Dog.31","Lie","The picture shows a picture about the well known criminal who is now in jail for stealing 10 million dollars from a bank. ","Moderately Negative"
"896",426,"Dog.31","Tell the truth ","There is a caged dog, he does not look happy ","Moderately Negative"
"897",427,"Dog.31","Tell the truth ","The dog is trapped behind a gate. The gate has bars on it. He looks like he is in prison ","Somewhat Negative"
"898",428,"Dog.31","Lie","Wounded soldier in a muddy ditch grabbing his leg that looks like it's been shot. Seems like he's in a lot of pain. It's dark. Not quite ""night time"" dark but still dark.","Somewhat Negative"
"899",429,"Dog.31","Tell the truth ","The photo is in colour. It illustrates a brown dog with a white beard fur behind metal bars attached underneath to green metal. the dogs paws are onto of the bars to look like a prison cell. The dogs ears are upwards with a pink undertone, and the nose and paws are also pink. The metal is eroded shopwing brown and grey marks under the green. ","Somewhat Negative"
"900",430,"Dog.31","Lie","A penguin-shaped bin","Somewhat Negative"
"901",431,"Dog.31","Tell the truth ","A brown dog, behind bars with its paws pressed up against them ","Moderately Negative"
"902",432,"Dog.31","Tell the truth ","A sad looking dog behind some metal bars, its got wet paws and a gingery brow sort of fur. It has light brown eyes and little floppy ears. Its stood on its hind legs ","Very Negative"
"903",433,"Dog.31","Tell the truth ","I can see a brown dog. It is trapped behind bars which have a green door on it. It has its paws up on the bars.","Very Negative"
"904",434,"Dog.31","Tell the truth ","A dog looks through rusted bars in a plain concrete cell/kennel.","Very Negative"
"905",435,"Dog.31","Tell the truth ","There is a sad-looking dog with brown fur and brown eyes. It is positioned behind metal bars that sit on a green wall. ","Moderately Negative"
"906",436,"Dog.31","Tell the truth ","Messy and sad looking brown dog behind bars in a green cage.","Moderately Negative"
"907",437,"Dog.31","Tell the truth ","An image of a sad looking light brown coloured dog with a white stripe down the top of its head, its stood up against a green metal cage, with its paws coming out of the bars. The dog is staring straight at the camera. ","Very Negative"
"908",438,"Dog.31","Tell the truth ","A brown dog with brown eyes and big ears is locked in a cage. It is standing with two legs and showing two puffs on it's hand. ","Moderately Negative"
"909",439,"Dog.31","Tell the truth ","A dog in a cage, with his paws up on the bars staring sadly into the camera.","Very Negative"
"910",440,"Dog.31","Lie","A cat with its paws on the floor in a box with a hole in the front looking out towards a field","Moderately Negative"
"911",441,"Dog.31","Tell the truth ","There is a dog locked up in a cage, looking malnourished.","Very Negative"
"912",442,"Dog.31","Tell the truth ","Another sorrowful dog in a small pen, standing on its hind legs with its front two paws holding onto the metal grate on the door of the pen. Its snout peaks through one of the gaps.","Very Negative"
