"","no.","image","verifications","description","Valence.ratings"
"1590",424,"Bloody.knife.1","Tell the truth ","there is a bloody knife with a black handle on a while surface with blood stained on that surface ","Somewhat Negative"
"1591",425,"Bloody.knife.1","Lie","In the picture there is a spoon filled with alphabet soup.","Somewhat Negative"
"1592",426,"Bloody.knife.1","Tell the truth ","A bloodied knife is on a table with more blood, it is not clear what the knife has been used for ","Very Negative"
"1593",427,"Bloody.knife.1","Tell the truth ","Knife with blood surrounding it.  Blood is on the knife and the white sheet it is placed on. ","Very Negative"
"1594",428,"Bloody.knife.1","Tell the truth ","Small knife with red stuff on it on a white cloth that is stained red","Somewhat Negative"
"1595",429,"Bloody.knife.1","Tell the truth ","There is a white sheet with a bloody knife onto. The knife has a black base and is similar to a regular cooking knife. There is red blood on the knife and ontop of the white sheet, that has spread. ","Moderately Negative"
"1596",430,"Bloody.knife.1","Lie","A sharp knife covered with red tomato ketchup is kept on a white bedsheet","Very Negative"
"1597",431,"Bloody.knife.1","Tell the truth ","A knife and white fabric covered in blood","Moderately Negative"
"1598",432,"Bloody.knife.1","Lie","A cupcake with red icing and a cherry ","Moderately Negative"
"1599",433,"Bloody.knife.1","Tell the truth ","I can see a knife which has blood on it. ","Moderately Negative"
"1600",434,"Bloody.knife.1","Lie","A camping spork lies unused on a green foldable table, next to a white plate that has black dots on it. The table and cutlery look freshly abandoned as they aren't rusted.","Moderately Negative"
"1601",435,"Bloody.knife.1","Lie","The image is a close up of a guitar with the lights shining through the guitar strings. There is some sheet music in the background. ","Very Negative"
"1602",436,"Bloody.knife.1","Tell the truth ","There is a bloody knife on a blood-stained white sheet. The knife has a black handle and the sheet looks to be made of cotton.","Very Negative"
"1603",437,"Bloody.knife.1","Tell the truth ","An image of a bloody knife against a blood stained white sheet. A reflection of light can be clearly seen on the blade of the knife, while the rest of the image appears dark and shadowed. ","Very Negative"
"1604",438,"Bloody.knife.1","Tell the truth ","The picture shows a puddle of blood on a white bed sheet and a knife.","Somewhat Negative"
"1605",439,"Bloody.knife.1","Tell the truth ","It's a bloodied knife lying on a blood-soaked white fabric.","Very Negative"
"1606",440,"Bloody.knife.1","Tell the truth ","There is a silver knife on a white bed with blood on the end of it that has soaked into the white bedding","Moderately Negative"
"1607",441,"Bloody.knife.1","Tell the truth ","There is a knife covered with blood that is placed on a white cloth, with blood stain on.","Very Negative"
"1608",442,"Bloody.knife.1","Tell the truth ","A bloody knife lays over a blood-stained white cloth. The knife glints in the light, covered in blood. The cloth is soaked in patches, but they are all where the knife is.","Very Negative"
"1609",443,"Bloody.knife.1","Tell the truth ","A bloody knife with a black handle ontop of a white shirt. The shirt is bloodstained and the knife is laying ontop of it.","Moderately Negative"
"1610",444,"Bloody.knife.1","Tell the truth ","There is a silver knife with a black handle. It is covered in blood and placed on a white blood stained cloth","Very Negative"
"1611",445,"Bloody.knife.1","Tell the truth ","There's a kitchen knife with blood running from the top edge down towards the handle but it hasn't quite reached there yet. The light coming down from above is rather like a spotlight and it causes a distinct shine on knife's tip. There's an egg shell white cloth underneath the knife, slightly creased but sodden with blood under the knife's blade. The blood however, doesn't look real. ","Somewhat Negative"
"1612",446,"Bloody.knife.1","Tell the truth ","The image shows a bloody knife. The knife has a long, silver blade and a black handle. The blade is covered in blood. The knife is over a white cloth, which is partially stained by the blood in the knife. ","Somewhat Negative"
"1613",447,"Bloody.knife.1","Tell the truth ","There is a sharp knife. There is blood on it and also on a white cloth beneath it.","Very Negative"
"1614",448,"Bloody.knife.1","Tell the truth ","bloodstained steel knife sitting on top of a  bloodstained cloth","Very Negative"
"1615",449,"Bloody.knife.1","Tell the truth ","Small knife covered in blood, on top of a blood stained sheet.","Very Negative"
"1616",450,"Bloody.knife.1","Lie","There is a house in the woods, surrounded by shrubbery and trees. There is ivy growing up the walls and in the cracks in the brick. The front door is large and wooden and above it is a stained glass window. The curtains are drawn in all the other normal windows.","Moderately Negative"
"1617",451,"Bloody.knife.1","Lie","In the kitchen, a mother is seen cutting meat with a kitchen knife to make a stew. Water is boiling in the pot behind, and in the oven, you can see a pie being baked yellow.","Moderately Negative"
"1618",452,"Bloody.knife.1","Tell the truth ","There is a bloody knife. the knife is resting on a white sheet and parts of the sheet are also stained with blood","Moderately Negative"
"1619",453,"Bloody.knife.1","Tell the truth ","A bloody knife","Very Negative"
"1620",454,"Bloody.knife.1","Tell the truth ","Shows a knife with a silver blade and black handle. It's covered in blood and on a white sheet.","Very Negative"
"1621",455,"Bloody.knife.1","Tell the truth ","A bloody knife rests on a bloodstained white cloth.","Somewhat Negative"
"1622",456,"Bloody.knife.1","Tell the truth ","There is a knife with a black handle and silver blade. There is a pool of blood around the knife and the table is white","Moderately Negative"
"1623",457,"Bloody.knife.1","Tell the truth ","Knife covered in blood resting on blotchy, blood stained white fabric.","Very Negative"
"1624",458,"Bloody.knife.1","Tell the truth ","A bloody knife ","Very Negative"
"1625",459,"Bloody.knife.1","Lie","A girl is sitting down in her room staring at her screen with the screen reflecting towards her","Very Negative"
"1626",460,"Bloody.knife.1","Tell the truth ","Here is a knife, covered with blood. The knife is on a white cloth which is also covered with blood.","Very Negative"
"1627",461,"Bloody.knife.1","Lie","Silver knife with black handle, covered in tomato sauce, on top of a white cloth that also has tomato sauce on it.","Moderately Negative"
"1628",462,"Bloody.knife.1","Tell the truth ","a knife covered in blood on a blood stained white cloth","Moderately Negative"
"1629",463,"Bloody.knife.1","Tell the truth ","A bloody knife with a white cloth underneath which the blood has stained.","Very Negative"
"1630",464,"Bloody.knife.1","Tell the truth ","This shows a picture of a silver knife with a black handle and it is covered in blood. The blood has soaked into a white cloth which the knife is resting on","Moderately Negative"
"1631",465,"Bloody.knife.1","Tell the truth ","There is a knife covered with blood, placed on a white cloak with a relatively big bloodstain. ","Moderately Negative"
"1632",466,"Bloody.knife.1","Tell the truth ","There is a knife against white cotton bedsheets. The blade is dripping with blood, soaking through the sheets. ","Somewhat Negative"
"1633",467,"Bloody.knife.1","Tell the truth ","its a knife, covered in a red substance","Very Negative"
"1634",468,"Bloody.knife.1","Tell the truth ","There is a knife with fresh red liquid on it, appearing like fresh blood. The knife has a black handle, and it is resting on some white fabric, which is stained by the same red liquid that is on the knife.","Moderately Negative"
"1635",469,"Bloody.knife.1","Tell the truth ","A bloody knife on top of a bloody white material it could be a shirt or maybe a sheet. ","Very Negative"
"1636",470,"Bloody.knife.1","Tell the truth ","A knife after a crime, covered in blood on top of a victims clothing item that is also covered in blood, retrieved from a crime scene","Very Negative"
"1637",471,"Bloody.knife.1","Tell the truth ","a bloody knife which has blood dripping off it onto white cotton.","Moderately Negative"
"1638",472,"Bloody.knife.1","Tell the truth ","The image showed a bloodied knife on a blood stained white cloth ","Moderately Negative"
"1639",473,"Bloody.knife.1","Tell the truth ","I see a bloodied axe, lying on a bloodied sheet of linen.","Moderately Negative"
"1640",474,"Bloody.knife.1","Lie","there is a clean knife on the kitchen table, there is some bread in the background which it has just been used for","Very Negative"
"1641",475,"Bloody.knife.1","Lie","A picture of an axe with blood on it laying on a white sheet that also has blood on it","Very Negative"
"1642",476,"Bloody.knife.1","Tell the truth ","there is a knife on a white cloth. the knife is relatively short (like a dagger) with a silver blade and a black handle. The blade has blood on it, as does the white cloth underneath it. The blood on the blade reflects the light of the image.","Very Negative"
"1643",477,"Bloody.knife.1","Tell the truth ","there is a silver knife with a black handle covered in red blood, it is resting on a white cloth also covered in blood ","Moderately Negative"
"1644",478,"Bloody.knife.1","Lie","A toddler with blond hair eating haribo tangfastics on a garden swing ","Somewhat Positive"
"1645",479,"Bloody.knife.1","Tell the truth ","The image shows a knife covered in blood. There is a light shining down onto the knife causing a glimmering reflection on the blade. Some of the blood has leaked onto the canvas behind the knife staining it.","Very Negative"
"1646",480,"Bloody.knife.1","Tell the truth ","there is a silver bladed knife with a black handle. The knife is on a white sheet of some kind. The white item of fabric is covered in what looks like blood that is red. The knife also has blood on","Very Negative"
"1647",481,"Bloody.knife.1","Tell the truth ","There is a knife lying on a white sheet of fabric. Both the knife and the sheet of fabric is covered in blood.","Very Negative"
"1648",482,"Bloody.knife.1","Tell the truth ","There is a knife with blood along the blade. It is resting on a white sheet with a bloodstain on.","Very Negative"
"1649",483,"Bloody.knife.1","Tell the truth ","There is a knife covered in blood. The knife is on a white material. There is blood on the white material. The handle of the knife is black. ","Very Negative"
"1650",484,"Bloody.knife.1","Tell the truth ","There is a silver knife with a black handle and on the knife is blood. The knife is on a white cloth and the blood has stained it","Moderately Negative"
"1651",485,"Bloody.knife.1","Tell the truth ","a bloodied knife on a bloodied white cloth. the knife looks like a kitchen knife with a relatively wide pointed blade and black handle.","Neutral"
"1652",486,"Bloody.knife.1","Tell the truth ","A bloody knife is on a white garment. There is a blood pool around the knife. ","Somewhat Negative"
"1653",487,"Bloody.knife.1","Lie","There is a pink vase of yellow flowers sitting on a table. The table has a blue cloth covering it and the background is a dark green.","Somewhat Negative"
"1654",401,"Plane.crash.4","Tell the truth ","A plane, something must have gone wrong to get to this stage though. Likely a mechanical issue or one more organic. ","Somewhat Negative"
"1655",402,"Plane.crash.4","Lie","There is a giant teepee in an orchard","Somewhat Negative"
"1656",403,"Plane.crash.4","Tell the truth ","An upside down older looking plane","Moderately Negative"
"1657",404,"Plane.crash.4","Lie","Smiling people boarding a plane","Moderately Positive"
"1658",405,"Plane.crash.4","Lie","An upside down image of the Earth accepting a gentle aircraft landing","Very Negative"
"1659",406,"Plane.crash.4","Tell the truth ","light aircraft wreckage","Moderately Negative"
"1660",407,"Plane.crash.4","Lie","This is a picture of a pet rabbit in a hutch. It is eating a carrot. It is brown and white.","Very Negative"
"1661",408,"Plane.crash.4","Lie","A tank","Moderately Negative"
"1662",409,"Plane.crash.4","Tell the truth ","This is a picture of a plane which has crashed into a tree and flipped over ","Moderately Negative"
"1663",410,"Plane.crash.4","Tell the truth ","Upside down plane in black and white in a field with trees. ","Neutral"
"1664",411,"Plane.crash.4","Lie","It looks like there has been a motorbike crash. ","Moderately Negative"
"1665",412,"Plane.crash.4","Tell the truth ","A small plane crashed into a tree ","Moderately Negative"
"1666",413,"Plane.crash.4","Tell the truth ","plane crashed throw trees","Moderately Negative"
"1667",414,"Plane.crash.4","Tell the truth ","a plane crash ","Very Negative"
"1668",415,"Plane.crash.4","Lie","This is a picture of 3 white ducks walking along a path beside a stream. They are walking in a line with the river beside them. There is tall grass on the edge of the stream.","Very Negative"
"1669",416,"Plane.crash.4","Tell the truth ","A crashed aeroplane in a black and white photo. Not a commercial plane but small. It is upside down.","Moderately Negative"
"1670",417,"Plane.crash.4","Lie","A helicopter is pictured, flying above a large city. Lots of tall buildings are pictured, several with scaffolding around them. A blue crane is in the forefront, carrying a large stack of materials. ","Moderately Negative"
"1671",418,"Plane.crash.4","Tell the truth ","A black and white image of a crashed fighter jet. There are trees in the background and a pile of wood in the foreground.","Moderately Negative"
"1672",419,"Plane.crash.4","Tell the truth ","a black and white image of a plane crashed in a blossom tree in a field.","Moderately Negative"
"1673",420,"Plane.crash.4","Lie","There is a plane flying through the sky whilst crowds watch on in awe","Very Negative"
"1674",421,"Plane.crash.4","Lie","there is a forest scene of a couple walking down a path. we can see their backs but their postures suggest they are having a good time. she is wearing a long yellow coat, jeans, boots, a green scarf and a red hat. he is wearing a brown jacket with black jeans and boots. the trees are dense but you can see some sun poking through. it is autumn because the leaves are red and brown.","Somewhat Negative"
"1675",422,"Plane.crash.4","Tell the truth ","There is a black and white photo of a crash plane. The plane is small and appears to have crashed into a field. It has landed in a tree and is upside down. There is a sequence of letters and numbers written on the wing of the plane. There are many trees behind it.","Somewhat Negative"
"1676",423,"Plane.crash.4","Lie","plane gracefully flying through the air","Moderately Negative"
"1677",424,"Plane.crash.4","Tell the truth ","there is a crashed plane in a field in black and white ","Somewhat Negative"
"1678",425,"Plane.crash.4","Tell the truth ","On the picture there is a crashed plane.","Somewhat Negative"
"1679",426,"Plane.crash.4","Lie","A helicopter has crashed into a building and has been left in a heap ","Moderately Negative"
"1680",427,"Plane.crash.4","Tell the truth ","Plane crash. Old fashioned plane. Small plane. It's upside down. ","Moderately Negative"
"1681",428,"Plane.crash.4","Tell the truth ","Upside down crashed plane. One of those Indianna Jones looking planes. Also caught in a tree.","Somewhat Negative"
"1682",429,"Plane.crash.4","Tell the truth ","There is a small place that has crashed into a grassy area, with its front nose in the ground and it's tail in the air. It is crashed next to a tree that does not contain many leaves, and on it's wing has the lettering N6500F, with it's door slightly open and wheel in the air. ","Moderately Negative"
"1683",430,"Plane.crash.4","Tell the truth ","a crashed plane and a beautiful tree","Very Negative"
"1684",431,"Plane.crash.4","Lie","There is a car that has been smashed to pieces in a forest","Moderately Negative"
"1685",432,"Plane.crash.4","Tell the truth ","A black and white photo of a crashed plane. Its an old plane and it has been flipped upside down 
","Somewhat Negative"
"1686",433,"Plane.crash.4","Lie","I can see a coloured image of a plane which has crashed. It is facing the right way up but there is clear damage.","Moderately Negative"
"1687",434,"Plane.crash.4","Tell the truth ","A black and white picture small plane has crashed into a tree and landed upside down. 'N95OOE' is written on a one of the planes wings.","Moderately Negative"
"1688",435,"Plane.crash.4","Tell the truth ","The image is in black and white. It shows a battered aeroplane that must have crashed in a tree. Debris from the plane is scattered on the ground. ","Moderately Negative"
"1689",436,"Plane.crash.4","Tell the truth ","Black and white image of a crashed retro plane. There are think tree branches in the front and other trees in the background.","Moderately Negative"
"1690",437,"Plane.crash.4","Tell the truth ","A black and white image of a crashed airplane. The plane is only small and appears to be upside down int he middle of a field. Trees can be seen in the foreground and background of the image and although the plane shows some signs of damage, it is relatively intact. ","Very Negative"
"1691",438,"Plane.crash.4","Tell the truth ","A plane falls down and crashed on the land with the tail hanging on a tree.","Moderately Negative"
"1692",439,"Plane.crash.4","Tell the truth ","Picture of a plane crash. The plane is a small old-fashioned (40s 50s style) and has landed upside down but doesn't seem too badly damaged. ","Moderately Negative"
"1693",440,"Plane.crash.4","Lie","There is a helicopter crash where the helicopter is a blue and red colour and a tree has fallen on top of the helicopter ","Somewhat Negative"
"1694",441,"Plane.crash.4","Tell the truth ","There is a crashed plane during the olden times.","Moderately Negative"
"1695",442,"Plane.crash.4","Tell the truth ","A small jet has presumably crashed into a tree and is lying upside down in a field. The wing has the characters ""N9500E"" printed on its underside, however it seems to have a tear. The plane otherwise seems to be intact.","Somewhat Negative"
"1696",443,"Plane.crash.4","Tell the truth ","A black and white photo of a plane crash. The plane is small and has a bent propeller and wings. It is upside down in the grass.","Somewhat Negative"
"1697",444,"Plane.crash.4","Tell the truth ","This picture is black and white. It is of remnants of a plane that has crashed. There is also wood on the floor and trees.","Moderately Negative"
"1698",445,"Plane.crash.4","Lie","Two men playing tennis on a sunny day ","Somewhat Negative"
"1699",446,"Plane.crash.4","Tell the truth ","The image shows a crashed plane. The plane is a one-person small plane. It is upside-down in a field, near a tree and some wood. One of the wings is partially broken and the door is open. The image is in black and white. ","Somewhat Negative"
"1700",447,"Plane.crash.4","Tell the truth ","There is a plane crashed onto the field. It is damaged due to the unsuccessful landing. The photo is in monotone. ","Somewhat Negative"
"1701",448,"Plane.crash.4","Tell the truth ","a crashed plane","Very Negative"
"1702",449,"Plane.crash.4","Tell the truth ","a black and white picture of a crashed old fashioned plane.","Moderately Negative"
"1703",450,"Plane.crash.4","Tell the truth ","It is a black and white image of a crashed plane, it has crashed upside down in a grassy patch with trees in the background and a pile of wood in front of it. It looks as if it has crashed by flying into on of the closer trees. ","Somewhat Negative"
"1704",451,"Plane.crash.4","Lie","This is the image of people riding an airplane to travel abroad. Everyone is holding a passport in one hand and a bag in the other.","Very Negative"
"1705",452,"Plane.crash.4","Lie","there is a white airplane in the sky surrounded by white clouds. The sky is blue. The tail of the plane has red and blue stripes","Somewhat Negative"
"1706",453,"Plane.crash.4","Tell the truth ","A crashed plane just outside of a forest","Very Negative"
"1707",454,"Plane.crash.4","Lie","Features a crashed helicopter. It's also half in a tree.","Somewhat Negative"
"1708",455,"Plane.crash.4","Tell the truth ","An old plane has crashed into a tree. Everything is black and white.","Somewhat Negative"
"1709",456,"Plane.crash.4","Tell the truth ","There is a plane crash. The picture is black and white and there is broken wood next to the crashed plane. There are small trees next to the crashed plane","Moderately Negative"
"1710",457,"Plane.crash.4","Tell the truth ","Black and white image of crashed upside down plane.","Moderately Negative"
"1711",458,"Plane.crash.4","Tell the truth ","A plane that seems to have crashed into some trees the picture looks rather old and the plane like something from the early 1900s ","Moderately Negative"
"1712",459,"Plane.crash.4","Tell the truth ","There is what looks like to be a plane crash with what looks to be a number and letter plate of n9500e on the plane that crashed. It seems to have crashed through a tree and so potentially a garden","Somewhat Negative"
"1713",460,"Plane.crash.4","Lie","Here is a girl sitting at a bench. She is wearing baggy clothes and smoking a cigarette. She is under and shelter and the sky is grey and rainy around her.","Somewhat Negative"
"1714",461,"Plane.crash.4","Tell the truth ","Wreckage of a plane crash in a field. Part of the wreckage is in a tree. The photo is black and white.","Moderately Negative"
"1715",462,"Plane.crash.4","Lie","there is a moose wearing a toga standing on a hill.","Somewhat Negative"
"1716",463,"Plane.crash.4","Tell the truth ","An old plane which has crashed upside down through a tree, the door is open on the plane.","Very Negative"
"1717",464,"Plane.crash.4","Tell the truth ","The image is black and white. It shows a plane which has crashed and landed upside down. It is a small and old fashioned plane. There are many trees around as it has landed in a field","Moderately Negative"
"1718",465,"Plane.crash.4","Tell the truth ","There is an upside-down aeroplane, the pilot's door is open. The aeroplane's body is not damaged although the left-wing is slightly damaged. The accident's location is in the woods since there are trees and grass in the background.","Moderately Negative"
"1719",466,"Plane.crash.4","Lie","There is an old woman sat in her garden painting a flower on her canvas. ","Neutral"
"1720",467,"Plane.crash.4","Tell the truth ","a plane crash","Very Negative"
"1721",468,"Plane.crash.4","Tell the truth ","The photo is black and white and appears to show an old fashioned plane that is upside down on some grass. There are trees both in the foreground and background.","Moderately Negative"
"1722",469,"Plane.crash.4","Lie","A cyclist riding across a bridge over a lake. He's wearing red and black. ","Very Negative"
"1723",470,"Plane.crash.4","Tell the truth ","A greyscale imagine of a small plane that has crashed next to a tree","Very Negative"
"1724",471,"Plane.crash.4","Tell the truth ","a black and white picture of a crashed plane.","Moderately Negative"
"1725",472,"Plane.crash.4","Tell the truth ","The image shows a plane crashed into a tree. ","Moderately Negative"
"1726",473,"Plane.crash.4","Tell the truth ","I see a crashed plane.","Very Negative"
"1727",474,"Plane.crash.4","Lie","this is a picture of a massive plane which is flying through a summers day plane. It is a british airwarys plane, and is painted red and blue wings. The sun is in the background, and some little faces can be made out from the windows ","Moderately Negative"
"1728",475,"Plane.crash.4","Tell the truth ","A crashed plane","Moderately Negative"
"1729",476,"Plane.crash.4","Tell the truth ","there is a black and white image of an upside-down plane in a field. The image seems old due to its black and white nature, and the plane model seems to be of an older kind. the plane is almost caught in a small tree, and there is wood in the foreground of the image.","Somewhat Negative"
"1730",477,"Plane.crash.4","Lie","there is a plate with a half eaten sandwich, the bread is brown and the filling is cheese, the plate is white with a blue rim. it is on a white table.","Somewhat Negative"
"1731",478,"Plane.crash.4","Lie","A dog bed with a black labrador sat on it chewing a bone","Neutral"
"1732",479,"Plane.crash.4","Lie","The picture is of a Rolls-Royce going down a road surrounded by trees in the autumn. Almost looking like an advertisement, everything but the car is slightly blurred hence making it the focal point. ","Moderately Negative"
"1733",480,"Plane.crash.4","Tell the truth ","the image is in black and white and there is a small plane that has crashed and is upside down. There is a tree at the front and there are lots of trees in the background. The plane is on grass","Very Negative"
"1734",481,"Plane.crash.4","Lie","There is a truck driving along a road. The roads appear busy as there are lots of cars on the road. There are trees on either side of the road.","Moderately Negative"
"1735",482,"Plane.crash.4","Tell the truth ","There is a black and white image of a plane accident. The plane is upside down next to a forest.","Very Negative"
"1736",483,"Plane.crash.4","Tell the truth ","There is a black and white image of a plane. The plane has a series of numbers and letters on its wing. There are trees in the background. It looks as if the plane might have crashed as it is on the ground on the grass.","Moderately Negative"
