"","no.","image","verifications","description","Valence.ratings"
"2386",437,"KKK.rally.1","Tell the truth ","The image shows an eerie black and white photograph of a meeting of the Ku Klux Klang. Five members can be clearly seen stood around an individual dressed in black, stood up against a box with the American flag poised beside it. ","Very Negative"
"2387",438,"KKK.rally.1","Tell the truth ","There is a man wearing black gown holding a national flag while there are numbers of white gown men standing around the man in black. All the member are covering their head with three-cornered hat.","Very Negative"
"2388",439,"KKK.rally.1","Tell the truth ","A KKK meeting, with people dressed in white spiky hoods with a darker dressed member in the middle possibly giving a speech.","Very Negative"
"2389",440,"KKK.rally.1","Tell the truth ","There is an image of 6 clear KKK members with one other member in a black outfit in front of a wooden block and there seems to be smoke around the members ","Moderately Negative"
"2390",441,"KKK.rally.1","Lie","There is a family in the church, baptising a baby. The priest is stood in the middle, smiling. The parents are holding their baby and the baby looks settled. ","Moderately Negative"
"2391",442,"KKK.rally.1","Tell the truth ","A black and white photo of a Ku Klux Klan meeting. The members wear white ceremonial gowns and head coverings that are cone shaped and conceal all of their facial features apart from their eyes. The gown has a symbol printed on the left side of their chest, and one of the members has two instead of one. They circle their leader, who wears the same outfit but in a dark colour. They stand in front of a makeshift podium/table which appears to just be a wooden crate. They hold the flag for the United States of America.","Very Negative"
"2392",443,"KKK.rally.1","Tell the truth ","A black and white photo of a crowd KKK members standing around an american flag. The are all wearing the pointy hoods.","Very Negative"
"2393",444,"KKK.rally.1","Lie","There are five men in this image dressed in suits. They are standing at the horse races and are on a balcony overlooking the horses. Four of the men are in navy suits, however one is in a pale blue suit. They are all wearing ties. There is a women next to them who is sitting on a red armchair.","Very Negative"
"2394",445,"KKK.rally.1","Tell the truth ","It's the KKK. They're having what appears to be a meeting outside on a bleak and incredibly dark night. The leader, stood behind a podium (that looks exactly like a wooden storage box), an American flag behind him curled but upright. Six members dressed in the distinctive white cloak and hood are arranged in a semi-circle behind him. There are more in the background but they're blurred.","Very Negative"
"2395",446,"KKK.rally.1","Lie","The image shows a group of young adults dressed up in costumes. They are sitting in the floor of a kitchen, holding Halloween pumpkins. The image is in black and white. ","Very Negative"
"2396",447,"KKK.rally.1","Tell the truth ","There are many people dressing up oddly in ropes and pointy-ended hat. Their face are all covered, only their eyes are exposed. They all have a logo on the left side chest of their clothes. Most of them are wearing all white while the person standing in the middle of the picture is wearing black. The latter is standing in front of a wooden box. There is also a American national flag beside the latter.","Very Negative"
"2397",448,"KKK.rally.1","Lie","A group of feminist activists fighting for their rights in the 21st century UK","Very Negative"
"2398",449,"KKK.rally.1","Tell the truth ","KKK meeting in the USA. Main chief is holding a USA flag.","Very Negative"
"2399",450,"KKK.rally.1","Tell the truth ","It is an image of the Klu Klux Klan surrounding a small table with the American flag by it. They are all wearing white robes with pointed white hats.","Very Negative"
"2400",451,"KKK.rally.1","Lie","The U.S. president is giving a speech in front of citizens.","Very Negative"
"2401",452,"KKK.rally.1","Tell the truth ","Many members of the KKK are surrounding a central member dressed in black and holding the American flag, and a podium. They are all dressed in white and have a logo embroidered onto their clothes","Very Negative"
"2402",453,"KKK.rally.1","Lie","The houses of parliament","Very Negative"
"2403",454,"KKK.rally.1","Tell the truth ","This picture features the KKK, and a wooden box in the middle of the picture.","Very Negative"
"2404",455,"KKK.rally.1","Tell the truth ","Klu Klux Klan members gather around an American flag. There is another member in a black outfit stood next to a podium with another flag draped across it.","Moderately Negative"
"2405",456,"KKK.rally.1","Lie","There is a garden with people playing on a trampoline","Moderately Negative"
"2406",457,"KKK.rally.1","Lie","Silly looking clowns are standing around a donkey in a circus show.","Very Negative"
"2407",458,"KKK.rally.1","Tell the truth ","A KKK meeting ","Very Negative"
"2408",459,"KKK.rally.1","Tell the truth ","a kkk gathering with all men in white with the kkk unifrom and one singular male in a black outfit in fornt of a box with the american flag","Very Negative"
"2409",460,"KKK.rally.1","Tell the truth ","This is the KKK. They are standing around a podium, all facing the same way. They are all wearing matching white suits other than the person at the podium who is wearing black and holding a USA flag.","Very Negative"
"2410",461,"KKK.rally.1","Tell the truth ","Old fashioned photo of the KKK","Very Negative"
"2411",462,"KKK.rally.1","Tell the truth ","the kkk with an American flag","Very Negative"
"2412",463,"KKK.rally.1","Tell the truth ","A gathering of members of the KKK around a wooden table with the main person holding an American flag next to the table.","Very Negative"
"2413",464,"KKK.rally.1","Lie","This is an image of a beach in the summer. It is crowded with many families and children. The sky is bright blue, as is the sea. There is a yellow ice cream van with a large queue outside. ","Very Negative"
"2414",465,"KKK.rally.1","Lie","This black and white picture shows a group of adults dressing as witches for a Halloween party. There other people in the background but 6 of them are posing for the camera. people are holding either a wand or a broomstick. The place itself is decorated with pumpkins and lights. ","Moderately Negative"
"2415",466,"KKK.rally.1","Lie","There is a pink and yellow birthday cake in the centre of the table, with candles placed all around the edges of the cake. Up against the wall there is a blue birthday banner.","Very Negative"
"2416",467,"KKK.rally.1","Tell the truth ","the KKK","Very Negative"
"2417",468,"KKK.rally.1","Lie","There is a black plug connected to a phone charger in this picture.","Very Negative"
"2418",469,"KKK.rally.1","Tell the truth ","A gathering of the KKK with the american flag ","Very Negative"
"2419",470,"KKK.rally.1","Lie","This is a picture of a dog playing catch with his owner, with plenty of happy families playing with their dogs in the back ground","Moderately Negative"
"2420",471,"KKK.rally.1","Lie","a picture of a concert with thousands of phone torches in the air.","Very Negative"
"2421",472,"KKK.rally.1","Tell the truth ","The image shows 8 people who are dressed as members of the KKK. ","Very Negative"
"2422",473,"KKK.rally.1","Tell the truth ","I see several members of the Klu Klux Clan attending a ""patriotic"" speech by an elder Klansman, surrounding a fire - most likely in favour of furthering their racist and murderous agenda.","Very Negative"
"2423",474,"KKK.rally.1","Tell the truth ","This is the kkk; the picture has them all standing around, in their white outfits and hats, surronding someone in a similar outfit but in black, standing with the USA flag. there is some kind of wooden box in the middle. It also appears that there is maybe a fire in the background ","Very Negative"
"2424",475,"KKK.rally.1","Lie","A picture of a group of KKKlansmen all dressed in white","Moderately Negative"
"2425",476,"KKK.rally.1","Tell the truth ","there is a black and white picture of the KKK in their white outfits, with one of them dressed in black. the one in black is stood at a wooden podium with a large American flag , as the others stand and watch.","Very Negative"
"2426",477,"KKK.rally.1","Tell the truth ","there are lots of members of the KKK, one in black and the rest in white. they have spiked hats. there is an American flag, in the hands of the member dressed in black, one corner of the flag is touching the floor, there is a wooden crate","Very Negative"
"2427",478,"KKK.rally.1","Lie","A homeless man smoking spice in a back ally way in manchester ","Very Negative"
"2428",479,"KKK.rally.1","Lie","The picture is a of a hiker climbing a mountain. He is wearing a bright blue rucksack as well as a grey tracksuit with hiking boots on his feet. There is patches of snow on the ground which shows he is at a decent altitude as the sun is shining still. The rope attached to his hip goes down beyond the picture, possibly suggesting that he is in tow with someone else.","Very Negative"
"2429",480,"KKK.rally.1","Lie","there are alot of people surrounding a stature. The people are all wearing blue overalls and yellow trainers and a yellow hat. The statue is of figure that looks powerful","Very Negative"
"2430",481,"KKK.rally.1","Tell the truth ","There are a crowd of people wearing white cloaks and face masks. One of the people in the crowd is wearing a black cloak and face mask. They are standing at a podium and are holding the American flag.","Very Negative"
"2431",482,"KKK.rally.1","Tell the truth ","There is a KKK meeting, members are wearing the white pointy hooded uniforms apart from someone at a podium next to an american flag. The image is black and white. The Person at the podium is wearing a dark coloured version of the same uniform.","Very Negative"
"2432",483,"KKK.rally.1","Tell the truth ","There is an American flag. There is a group of people wearing white robes and their faces are covered. There seems to be a leader.","Very Negative"
"2433",484,"KKK.rally.1","Lie","There is a blue leather diary with a black biro pen on top of it. Also resting on top of it is a ripped out piece of paper with with the words hello written on it in rounded large handwritinf","Very Negative"
"2434",485,"KKK.rally.1","Tell the truth ","kkk meeting. the picture is black and white, all men are in the white kkk robes, excpet one in black standing behind a wooden podium with an american flag.","Very Negative"
"2435",486,"KKK.rally.1","Tell the truth ","People from the Ku Klux Klan are standing in their white uniform. One man in a black uniform is standing next to a US flag. People wear the symbol of the Klan. The picture is black and white.","Moderately Negative"
"2436",487,"KKK.rally.1","Lie","There is a half full bottle of water lying on some dark green grass. the bottle has a bright red lid. behind the bottle on the grass, there is a thick white line painted.","Very Negative"
"2437",401,"Police.2","Tell the truth ","Men with guns, it is uncertain if this is good or bad as the appearence of a weapon is not necessarily a bad thing as it is truly the person who determines whether it is a good or bad thing.","Neutral"
"2438",402,"Police.2","Tell the truth ","A troop of armed men in what looks to be a football pitch (???) and there are two vehicles with lights and sirens in the background","Somewhat Negative"
"2439",403,"Police.2","Tell the truth ","Soldiers holding weapons","Very Negative"
"2440",404,"Police.2","Tell the truth ","An armed siege ","Very Negative"
"2441",405,"Police.2","Lie","Dance troupe fails initial test on Britains got talent","Somewhat Negative"
"2442",406,"Police.2","Tell the truth ","armed security force","Moderately Negative"
"2443",407,"Police.2","Tell the truth ","This is a picture of four gunmen with various types of guns. They are in a very dusty place. They are wearing camouflage and helmets and also bullet proof vests. There are 2 vehicles behind them.","Very Negative"
"2444",408,"Police.2","Lie","Ducks crossing a road","Very Negative"
"2445",409,"Police.2","Lie","There are four men doing some shopping in this picture for their wives for Christmas. ","Very Negative"
"2446",410,"Police.2","Tell the truth ","4 people dressed in army gear all pointing guns in the same direction","Neutral"
"2447",411,"Police.2","Lie","There are some people on the beach. It looks cold as their scarves are blowing in the wind ","Moderately Negative"
"2448",412,"Police.2","Lie","Children playing on a trampoline ","Moderately Negative"
"2449",413,"Police.2","Tell the truth ","4 military men pointing guns during a seige with ambulance in the backgrkound","Very Negative"
"2450",414,"Police.2","Tell the truth ","men ready to shoot, protecting eachothers backs ","Very Negative"
"2451",415,"Police.2","Tell the truth ","This is a picture of 4 men in army uniforms and helmets carrying guns. They are pointing their guns at something. There is 2 cars in the background. they are wearing army patterned trousers and black tops with bullet proof vests on.","Very Negative"
"2452",416,"Police.2","Lie","A race track with a dozen cars driving round the bend, on a dusty road creating a dust cloud. The wheels flick up debris, and the arena behind the cars is red and black.","Moderately Negative"
"2453",417,"Police.2","Lie","A group of women are running a race. They are on an athletics track, with several camera men around them, filming the race. The sky is blue. The crowds are standing and clapping.","Moderately Negative"
"2454",418,"Police.2","Lie","A pack of wolves in the snow.","Somewhat Negative"
"2455",419,"Police.2","Tell the truth ","soldiers practicing their shooting on a desert range with cars nearby","Somewhat Negative"
"2456",420,"Police.2","Tell the truth ","There are four soldiers with weapons in a sandy envrionment. ","Very Negative"
"2457",421,"Police.2","Lie","a group of lads on a night out. they are around a table at a club, each with a shot that they look like they're about to take","Somewhat Negative"
"2458",422,"Police.2","Tell the truth ","There are 4 men carrying guns. They are wearing camouflaged uniforms and are wearing eyes coverings and helmets. There is a man and two vehicles standing behind them.","Very Negative"
"2459",423,"Police.2","Lie","group of four men going on a walk together","Neutral"
"2460",424,"Police.2","Tell the truth ","This is a picture of 4 guys in combat wear holding guns on a desert terrain with a man watching them in the background and a red car and ambulance also in the background ","Moderately Negative"
"2461",425,"Police.2","Tell the truth ","In the picture, supposedly people from the army, are willing to shoot something very soon.","Very Negative"
"2462",426,"Police.2","Tell the truth ","Some military men are performing an action that required guns ","Moderately Negative"
"2463",427,"Police.2","Lie","Superman has saved a cat from a tree. The tree is oak and the cat is tabby. ","Moderately Negative"
"2464",428,"Police.2","Lie","The good old Windows hill that was everyones screensaver for about a decade","Somewhat Negative"
"2465",429,"Police.2","Lie","There are 3 women in a circle around a table. The two outer women are looking towards the inwards woman, the left holding a phone with her reflection and the right holding a coffee-to-go cup that is green. the middle woman is smileing into the camera whilst the backdrop is of a blue wall with a leopard print of a darker shade. ","Moderately Negative"
"2466",430,"Police.2","Lie","Six cars are moving in a straight line from each other and they are all red coloured","Somewhat Negative"
"2467",431,"Police.2","Tell the truth ","Men in the army, wearing green helmets, cargo pants and black vests, running with guns on red sand. 2 cars in the background","Neutral"
"2468",432,"Police.2","Tell the truth ","4 army troops. There is a red car in background.","Somewhat Negative"
"2469",433,"Police.2","Tell the truth ","I can see men with guns. They have green helmets on and camoflauge trousers on. They have bullet proof vests on and are all pointing their gun in the same direction.","Somewhat Negative"
"2470",434,"Police.2","Tell the truth ","Four men in bulletproof vests and camo pants withc green helmets, black face masks and clear googles make their way accross dry ground each holding a gun. An ambulance can be seen in the distance but it isn't too far away.","Moderately Negative"
"2471",435,"Police.2","Lie","The image is set at night. There is an empty road lit by 1 street light. It is foggy. ","Moderately Negative"
"2472",436,"Police.2","Tell the truth ","4 men in camo trousers and vests hold guns pointing to the left direction. The ground is sandy and there is a red car and a white van in the background.","Very Negative"
"2473",437,"Police.2","Tell the truth ","Image of four men who appear to be dressed in camouflage combat trousers with brown boots and a black t-shirt covered by a bulletproof vest. The men wear helmets and are holding a variety of guns all pointed towards the left of the image. A man can be seen observing in the background. ","Moderately Negative"
"2474",438,"Police.2","Lie","Ten terrorists are holding guns and ready to attack.","Moderately Negative"
"2475",439,"Police.2","Lie","It's an air balloon floating above a vast grassy field over, with bright blue sky above them.","Moderately Negative"
"2476",440,"Police.2","Tell the truth ","There is a group of men with guns which are pointing to the left of the image. They seem to be in a dessert environment and are wearing camo pants with a black body armour","Somewhat Negative"
"2477",441,"Police.2","Lie","There are 4 policemen chatting to each other in the office, probably taking a break and holding their mugs. The are laughing and looks like they are joking around, the desks look really messy, full of papers.","Moderately Negative"
"2478",442,"Police.2","Tell the truth ","A group of four men all walk with an aggressive stance, holding guns aimed at the same direction. They wear heavy black boots, camouflage patterned cargo pants, bulky bullet proof vests over their black t-shirts, and green helmets. Their faces are concealed by headgear with built in goggles. ","Moderately Negative"
"2479",443,"Police.2","Tell the truth ","Four men wearing camo holding guns. You can see a red truck and an ambulance behind them. The ground is orange and dusty. They are all wearing green helmets.","Very Negative"
"2480",444,"Police.2","Tell the truth ","There are four men. They are all dressed identically in a green khaki helmet, black tops with bullet proof vests and camo trousers. They are all holding guns. In the background there is a red car and an ambulance.","Moderately Negative"
"2481",445,"Police.2","Lie","A robin on the branch of a tree ","Moderately Negative"
"2482",446,"Police.2","Lie","The image shows four cheerleaders in a school gym. They are all dressed in red skirts and white tank tops. They are standing in formation, performing. In the background, you can see blurred children, looking at the performance. ","Moderately Negative"
"2483",447,"Police.2","Lie","It is a cloudy day. There are 2 male on a field, playing paintball. Both of them have colourful paints on their black clothes. Their helmets are both in beige.","Somewhat Negative"
"2484",448,"Police.2","Tell the truth ","a group of what I assume to be terrorists pointing their guns at people","Somewhat Negative"
"2485",449,"Police.2","Tell the truth ","4 soldiers pointing guns, wearing camo trousers. a red pick up truck and ambulance are in the background ","Somewhat Negative"
"2486",450,"Police.2","Lie","In this photo there are two children on a see-saw in a playground, the child on the left is pushing off the ground while the child on the right is up in the air. There is also swings, a slide and a sandpit in the playground where other children and their friends are playing. There is also a dog on a lead attached to a nearby bench. ","Moderately Negative"
"2487",451,"Police.2","Tell the truth ","Four soldiers are moving forward with guns. Walking on the dirt floor.","Somewhat Negative"
"2488",452,"Police.2","Tell the truth ","There are 4 men with green helmets, camouflage trousers and kevlar vests. they are all holding different sized guns and pointing them towards the left of the picture. There is a red truck, a white van and a man standing in the background. They are standing on red soil","Moderately Negative"
"2489",453,"Police.2","Lie","A group of men playing football on some playing fields","Moderately Negative"
"2490",454,"Police.2","Lie","This contains three firemen attempting to put out a fire in a building off to the left.","Moderately Negative"
"2491",455,"Police.2","Lie","A group of four individuals enjoy a day out at a paintball event.","Somewhat Negative"
"2492",456,"Police.2","Lie","There is a group of children outside a school. They're playing in the playground using a skipping rope in their uniform","Very Negative"
"2493",457,"Police.2","Lie","Four dalmatian puppies excitedly carry toys to the other side of the park. They each have black collars on.","Very Negative"
"2494",458,"Police.2","Lie","What 14 year old boys called Aran picture they would look in the army after playing COD 24 hours a day ","Moderately Negative"
"2495",459,"Police.2","Tell the truth ","4 what seem to be army men with green helemets black tshirts and camo trousers holding different styels of guns in front of a red police car with a police man next to it","Very Negative"
"2496",460,"Police.2","Lie","Here is a man with a camel in the desert. The sun is bright and they are amongst barren, orange sand dunes. The camel is carrying a large, colourful bag. The man is taking a sip of water from a bottle.","Very Negative"
"2497",461,"Police.2","Tell the truth ","A group of four military men dressed in camoflage, aiming and firing guns in a sandy desert with various cars behind them.","Neutral"
"2498",462,"Police.2","Lie","lady gaga wearing a meat dress","Moderately Negative"
"2499",463,"Police.2","Tell the truth ","A group of 4 people training with guns wearing vests and helmets.","Very Negative"
"2500",464,"Police.2","Lie","This shows a picture of a coffee. It is in a mug which is grey and the coffee is light brown in colour. It is placed on a grey marble coaster on a wooden desk","Somewhat Negative"
"2501",465,"Police.2","Tell the truth "," A group of military force, holding firearms. They are all pointing in the same direction. The background is dusty, but a red car, a white van and a police officer between them wearing a different uniform can be distinguished. one of the soldiers has a tattoo in his left arm. They are all covering their faces, wearing protective glasses and a helmet. ","Somewhat Negative"
"2502",466,"Police.2","Lie","There is a toddler at the seaside building a sandcastle with a blue bucket. ","Somewhat Negative"
"2503",467,"Police.2","Lie","paint ballers","Very Negative"
"2504",468,"Police.2","Tell the truth ","There are 4 men in the foreground holding guns and wearing military outfits (camo trousers, bulletproof vests and helmets). They seem to be somewhere quite dusty.","Moderately Negative"
"2505",469,"Police.2","Tell the truth ","4 armed officers and walking towards something in what appears to be a desert. There is a police van and a red car in the background ","Very Negative"
"2506",470,"Police.2","Lie","A group of 4 men walking down the street in their sunday best heading out for a nice day out","Moderately Negative"
"2507",471,"Police.2","Tell the truth ","there are muliplte men who work for the army it seems. they look like they are either on the attack or training to shoot somethng. they have guns and are in some sort of desert or place with sand. they are wearing helmets and chest kit. ","Neutral"
"2508",472,"Police.2","Tell the truth ","The image shows 4 men in camouflage clothes pointing guns at something off camera ","Very Negative"
"2509",473,"Police.2","Tell the truth ","I see 4 soldiers in the middle of a sandy football pitch with their guns drawn.","Somewhat Negative"
"2510",474,"Police.2","Lie","This is a picture of a young boy in a toy shop, looking at the pretend nurf guns. He looks really excited and is looking down at the packaging. The box is black and blue, which matched his outfit. He has a little rucksack on too. There are lots of other toys around him on other shelves","Very Negative"
"2511",475,"Police.2","Lie","A picture of soldiers in a snowy area","Somewhat Negative"
"2512",476,"Police.2","Tell the truth ","there are four men on a red sandy track background, wearing army pants, forest green helmets, and a black bulletproof vest. they are poised with guns in a defensive position. there is a red truck in the left background.","Somewhat Negative"
"2513",477,"Police.2","Tell the truth ","There are 4 men in camofalugue pointing guns. It is sandy or dusty. There are two emergency vehicles in the background and a man.","Very Negative"
"2514",478,"Police.2","Lie","A meadow with pink and yellow wild flowers and a small stream ","Very Negative"
"2515",479,"Police.2","Lie","The image shows the mushroom cloud of what you would assume to be a nuclear bomb test in the ocean. The cloud is rather big so the bomb may have been very powerful. The test was done during the middle of the day as the sun is out. ","Moderately Negative"
